### ISSUE TITLE
Support for Binding of Outgoing Connections

### ISSUE THREAD

**Issue by mfeit-internet2** [perfsonar/pscheduler#234]
To support Ivan's bind-from-elsewhere use case:

 * Rewrite the `url_*` functions to use PyCURL and have optional binding arguments
 * Add a `--bind` switch to all commands that need it (`cancel`, `monitor`, `ping`, `result`, `schedule`, `task` and `watch`)
 * Add a `bind` field to the task JSON
 * Add a `bind` field to the `task` and `http_queue` tables in the database
 * Adjust `scheduler` and `runner` to honor the binding
 * All archivers that use the network will require a `bind` in their `data`.

December 11:  Will also need to have a `lead-bind` item to specify what interface the lead uses when talking to the other participants.

Here's a bit of sample `GET` code using PyCURL.
```
import pycurl, StringIO, re
c = pycurl.Curl()
c.setopt(pycurl.URL, 'http://myproxylists.com/my-http-headers')
c.setopt(pycurl.INTERFACE, "10.0.2.15")
b = StringIO.StringIO()
c.setopt(pycurl.WRITEFUNCTION, b.write)
c.setopt(pycurl.SSL_VERIFYPEER, False)
c.setopt(pycurl.SSL_VERIFYHOST, False)
c.perform()
rsp = b.getvalue()
mtch = re.search(r'REMOTE_ADDR == (\d{1,3}\.\d{1,3}\.\d{1,3}\.\d{1,3})', rsp)
print mtch.group(1)
```

**Comment by igarny** [comment]
Hi Mark,
Thanks for the structured description in the ticket.

I would like to point out, that I do not have an use case for the archivers point. I am not saying it is not a good idea. It is just not be supported by the Meshconfig currently.

Generally IMHO applying same organization and line of operation at all levels and tools is the best approach, hence I tend to support it.
It seems to me the described solution does not cover fully the #33 use case, but will have an impact / effect there. The way I see it is the lead participant will not need to have extra parameter for bind with current suggestion.
Probably you can merge the 2 tickets, but I am not asking for this....I am only pointing it out for consideration.
Regards,
Ivan

**Comment by igarny** [comment]
### Ability of pscheduler to negotiate a test with a remote party through NAT. The test is negotiated for a different interface on the RRZE instance.

as of current pscheduler release: 
pscheduler-core.noarch              1.0-0.18.rc2.el6.1102.d9d7a10d4dae197e5bd5e617789bae72ae48956b

I was able to observe/capture the communication of the local RRZE pscheduler with the remote pscheduler on antg-dev.es.net from the Dev Test mesh on the default GW interface behind a NAT with no extra parameters for binding defined. (see below)

Extra info from MaDDash.
The dashboard of the Dev Test mesh states:
- full TCP throughput test
- failures on UDP throughput tests initiated from antg-dev.es.net and in general in RRZE as receiver
- failures on latency tests initiated from antg-dev.es.net


`
17:43:24.732282 IP 198.128.151.17.443 > 192.168.71.11.44924: Flags [P.], seq 1506:1764, ack 374, win 32, options [nop,nop,TS val 3447180803 ecr 109018209], length 258
17:43:24.732677 IP 192.168.71.11.44924 > 198.128.151.17.443: Flags [P.], seq 374:936, ack 1764, win 32, options [nop,nop,TS val 109018382 ecr 3447180803], length 562
17:43:24.942758 IP 198.128.151.17.443 > 192.168.71.11.44924: Flags [.], ack 936, win 32, options [nop,nop,TS val 3447181014 ecr 109018382], length 0
17:43:32.458168 IP 198.128.151.17.443 > 192.168.71.11.44924: Flags [P.], seq 1764:2853, ack 936, win 32, options [nop,nop,TS val 3447188529 ecr 109018382], length 1089
17:43:32.458403 IP 198.128.151.17.443 > 192.168.71.11.44924: Flags [P.], seq 2853:2884, ack 936, win 32, options [nop,nop,TS val 3447188529 ecr 109018382], length 31
17:43:32.458505 IP 198.128.151.17.443 > 192.168.71.11.44924: Flags [F.], seq 2884, ack 936, win 32, options [nop,nop,TS val 3447188529 ecr 109018382], length 0
17:43:32.460405 IP 192.168.71.11.44924 > 198.128.151.17.443: Flags [R.], seq 936, ack 2885, win 32, options [nop,nop,TS val 109026109 ecr 3447188529], length 0
`

**Comment by mfeit-internet2** [comment]
Brief update:

I did some experimentation with Requests (the library I'm using now) and PyCURL.  Requests has an add-on library called requests-toolbelt that's supposed to allow this to happen but doesn't.  PyCURL allows it in theory, but libCURL, which underpins it, has a bug where you can't give it a hostname or IP address:

```
% curl -k --interface 127.0.0.1 https://localhost/pscheduler/
curl: (45) bind failed with errno 22: Invalid argument

% curl -k --interface lo https://localhost/pscheduler/
"This is the pScheduler API server on localhost.localdomain (dev7)."
```

the solution, if we go the PyCURL route, will be to use the `netifaces` module to figure out what interface matches the bind IP.  There may also be a way to do it with the `socket` module.

**Comment by igarny** [comment]
Hi Mark,

Thanks for sharing. I see this had been an issues with the curl libraries at one point of time. The good news is that the latest release does manage the "--interface" option properly:

**Comment by igarny** [comment]
related to #159

**Comment by mfeit-internet2** [comment]
Relevent:

[Binding Options.pdf](https://github.com/perfsonar/pscheduler/files/807310/Binding.Options.pdf)

**Comment by mfeit-internet2** [comment]
What is being developed is described here:  https://github.com/perfsonar/pscheduler/wiki/Binding-Requests

**Comment by mfeit-internet2** [comment]
This is done but not pushed.  Waiting until Monday for that.
