### ISSUE TITLE
Check that post-test result gathering is properly bound.

### ISSUE THREAD

**Issue by mfeit-internet2** [perfsonar/pscheduler#373]
Title says it all.

**Comment by mfeit-internet2** [comment]
Appears to be fine.

```
				 TEST

% pscheduler task --lead-bind 192.168.222.7 simplestream --source 10.0.0.7 --dest 10.0.0.6 --dest-node 192.168.222.6
Submitting task...
Task URL:
https://10.0.0.7/pscheduler/tasks/67ce76dc-525e-4ffc-82bb-1d929661ecf6
Running with tool 'simplestreamer'
Fetching first run...

Next scheduled run:
https://10.0.0.7/pscheduler/tasks/67ce76dc-525e-4ffc-82bb-1d929661ecf6/runs/32e97704-4583-40bd-b6e2-f6bb17da7ec1
Starts 2017-03-17T10:54:01-04:00 (~7 seconds)
Ends   2017-03-17T10:54:06-04:00 (~4 seconds)
Waiting for result...

Dawdled ......... P0D
Text Sent ....... Data sent at 2017-03-17 10:54:01.158128
Text Received ... Data sent at 2017-03-17 10:54:01.158128
Elapsed Time .... PT0.434225S

No further runs scheduled.



		      CAPTURE OF NETWORK TRAFFIC

  (10.0.0.0/24 and 192.168.222.0/24 on the same physical interface)

----- TEST AND RUN NEGOTIATION

  1 0.000000000 192.168.222.7 -> 192.168.222.6 TCP 74 41378 > https [SYN] Seq=0 Win=29200 Len=0 MSS=1460 SACK_PERM=1 TSval=896611905 TSecr=0 WS=128
  2 0.000273804 192.168.222.6 -> 192.168.222.7 TCP 74 https > 41378 [SYN, ACK] Seq=0 Ack=1 Win=28960 Len=0 MSS=1460 SACK_PERM=1 TSval=896593115 TSecr=896611905 WS=128
  3 0.000308651 192.168.222.7 -> 192.168.222.6 TCP 66 41378 > https [ACK] Seq=1 Ack=1 Win=29312 Len=0 TSval=896611905 TSecr=896593115
  4 0.000735491 192.168.222.7 -> 192.168.222.6 SSL 325 Client Hello
  5 0.000950464 192.168.222.6 -> 192.168.222.7 TCP 66 https > 41378 [ACK] Seq=1 Ack=260 Win=30080 Len=0 TSval=896593115 TSecr=896611905
  6 0.007653361 192.168.222.6 -> 192.168.222.7 TLSv1.2 1552 Alert (Level: Warning, Description: Unrecognized Name), Server Hello, Certificate, Server Key Exchange, Server Hello Done
  7 0.007681095 192.168.222.7 -> 192.168.222.6 TCP 66 41378 > https [ACK] Seq=260 Ack=1487 Win=32256 Len=0 TSval=896611912 TSecr=896593119
  8 0.014309725 192.168.222.7 -> 192.168.222.6 TLSv1.2 260 Client Key Exchange, Change Cipher Spec, Encrypted Handshake Message
  9 0.016124866 192.168.222.6 -> 192.168.222.7 TLSv1.2 340 New Session Ticket, Change Cipher Spec, Encrypted Handshake Message
 10 0.016412405 192.168.222.7 -> 192.168.222.6 TLSv1.2 296 Application Data
 11 0.034269518 192.168.222.6 -> 192.168.222.7 TLSv1.2 380 Application Data, Application Data
 12 0.034314534 192.168.222.6 -> 192.168.222.7 TCP 66 https > 41378 [FIN, ACK] Seq=2075 Ack=684 Win=32256 Len=0 TSval=896593149 TSecr=896611921
 13 0.035272317 192.168.222.7 -> 192.168.222.6 TCP 66 41378 > https [FIN, ACK] Seq=684 Ack=2076 Win=38016 Len=0 TSval=896611940 TSecr=896593149
 14 0.035507173 192.168.222.6 -> 192.168.222.7 TCP 66 https > 41378 [ACK] Seq=2076 Ack=685 Win=32256 Len=0 TSval=896593150 TSecr=896611940
 15 0.036875636 192.168.222.7 -> 192.168.222.6 TCP 74 41978 > https [SYN] Seq=0 Win=29200 Len=0 MSS=1460 SACK_PERM=1 TSval=896611941 TSecr=0 WS=128
 16 0.037123973 192.168.222.6 -> 192.168.222.7 TCP 74 https > 41978 [SYN, ACK] Seq=0 Ack=1 Win=28960 Len=0 MSS=1460 SACK_PERM=1 TSval=896593152 TSecr=896611941 WS=128
 17 0.037154132 192.168.222.7 -> 192.168.222.6 TCP 66 41978 > https [ACK] Seq=1 Ack=1 Win=29312 Len=0 TSval=896611942 TSecr=896593152
 18 0.037688899 192.168.222.7 -> 192.168.222.6 SSL 325 Client Hello
 19 0.037949035 192.168.222.6 -> 192.168.222.7 TCP 66 https > 41978 [ACK] Seq=1 Ack=260 Win=30080 Len=0 TSval=896593152 TSecr=896611942
 20 0.044629333 192.168.222.6 -> 192.168.222.7 TLSv1.2 1552 Alert (Level: Warning, Description: Unrecognized Name), Server Hello, Certificate, Server Key Exchange, Server Hello Done
 21 0.044736912 192.168.222.7 -> 192.168.222.6 TCP 66 41978 > https [ACK] Seq=260 Ack=1487 Win=32256 Len=0 TSval=896611949 TSecr=896593159
 22 0.051232211 192.168.222.7 -> 192.168.222.6 TLSv1.2 260 Client Key Exchange, Change Cipher Spec, Encrypted Handshake Message
 23 0.052979791 192.168.222.6 -> 192.168.222.7 TLSv1.2 340 New Session Ticket, Change Cipher Spec, Encrypted Handshake Message
 24 0.053275036 192.168.222.7 -> 192.168.222.6 TLSv1.2 495 Application Data
 25 0.093210595 192.168.222.6 -> 192.168.222.7 TCP 66 https > 41978 [ACK] Seq=1761 Ack=883 Win=32256 Len=0 TSval=896593208 TSecr=896611958
 26 0.319049340 192.168.222.6 -> 192.168.222.7 TLSv1.2 619 Application Data, Application Data
 27 0.319082066 192.168.222.6 -> 192.168.222.7 TCP 66 https > 41978 [FIN, ACK] Seq=2314 Ack=883 Win=32256 Len=0 TSval=896593433 TSecr=896611958
 28 0.319904459 192.168.222.7 -> 192.168.222.6 TCP 66 41978 > https [FIN, ACK] Seq=883 Ack=2315 Win=38016 Len=0 TSval=896612224 TSecr=896593433
 29 0.320122487 192.168.222.6 -> 192.168.222.7 TCP 66 https > 41978 [ACK] Seq=2315 Ack=884 Win=32256 Len=0 TSval=896593435 TSecr=896612224
 30 0.922592916 192.168.222.7 -> 192.168.222.6 TCP 74 41476 > https [SYN] Seq=0 Win=29200 Len=0 MSS=1460 SACK_PERM=1 TSval=896612827 TSecr=0 WS=128
 31 0.922883462 192.168.222.6 -> 192.168.222.7 TCP 74 https > 41476 [SYN, ACK] Seq=0 Ack=1 Win=28960 Len=0 MSS=1460 SACK_PERM=1 TSval=896594037 TSecr=896612827 WS=128
 32 0.922918494 192.168.222.7 -> 192.168.222.6 TCP 66 41476 > https [ACK] Seq=1 Ack=1 Win=29312 Len=0 TSval=896612828 TSecr=896594037
 33 0.923425267 192.168.222.7 -> 192.168.222.6 SSL 325 Client Hello
 34 0.923653338 192.168.222.6 -> 192.168.222.7 TCP 66 https > 41476 [ACK] Seq=1 Ack=260 Win=30080 Len=0 TSval=896594038 TSecr=896612828
 35 0.929819313 192.168.222.6 -> 192.168.222.7 TLSv1.2 1552 Alert (Level: Warning, Description: Unrecognized Name), Server Hello, Certificate, Server Key Exchange, Server Hello Done
 36 0.929874682 192.168.222.7 -> 192.168.222.6 TCP 66 41476 > https [ACK] Seq=260 Ack=1487 Win=32256 Len=0 TSval=896612835 TSecr=896594041
 37 0.936390965 192.168.222.7 -> 192.168.222.6 TLSv1.2 260 Client Key Exchange, Change Cipher Spec, Encrypted Handshake Message
 38 0.938167358 192.168.222.6 -> 192.168.222.7 TLSv1.2 340 New Session Ticket, Change Cipher Spec, Encrypted Handshake Message
 39 0.938463921 192.168.222.7 -> 192.168.222.6 TLSv1.2 649 Application Data
 40 0.979153974 192.168.222.6 -> 192.168.222.7 TCP 66 https > 41476 [ACK] Seq=1761 Ack=1037 Win=32384 Len=0 TSval=896594094 TSecr=896612843
 41 1.518986784 192.168.222.6 -> 192.168.222.7 TLSv1.2 412 Application Data, Application Data
 42 1.519018794 192.168.222.6 -> 192.168.222.7 TCP 66 https > 41476 [FIN, ACK] Seq=2107 Ack=1037 Win=32384 Len=0 TSval=896594633 TSecr=896612843
 43 1.519732266 192.168.222.7 -> 192.168.222.6 TCP 66 41476 > https [FIN, ACK] Seq=1037 Ack=2108 Win=38016 Len=0 TSval=896613424 TSecr=896594633
 44 1.520007892 192.168.222.6 -> 192.168.222.7 TCP 66 https > 41476 [ACK] Seq=2108 Ack=1038 Win=32384 Len=0 TSval=896594634 TSecr=896613424
 45 1.520966775 192.168.222.7 -> 192.168.222.6 TCP 74 56747 > https [SYN] Seq=0 Win=29200 Len=0 MSS=1460 SACK_PERM=1 TSval=896613425 TSecr=0 WS=128
 46 1.521201257 192.168.222.6 -> 192.168.222.7 TCP 74 https > 56747 [SYN, ACK] Seq=0 Ack=1 Win=28960 Len=0 MSS=1460 SACK_PERM=1 TSval=896594636 TSecr=896613425 WS=128
 47 1.521246949 192.168.222.7 -> 192.168.222.6 TCP 66 56747 > https [ACK] Seq=1 Ack=1 Win=29312 Len=0 TSval=896613426 TSecr=896594636
 48 1.521677538 192.168.222.7 -> 192.168.222.6 SSL 325 Client Hello
 49 1.522373873 192.168.222.6 -> 192.168.222.7 TCP 66 https > 56747 [ACK] Seq=1 Ack=260 Win=30080 Len=0 TSval=896594636 TSecr=896613426
 50 1.528306116 192.168.222.6 -> 192.168.222.7 TLSv1.2 1552 Alert (Level: Warning, Description: Unrecognized Name), Server Hello, Certificate, Server Key Exchange, Server Hello Done
 51 1.528393836 192.168.222.7 -> 192.168.222.6 TCP 66 56747 > https [ACK] Seq=260 Ack=1487 Win=32256 Len=0 TSval=896613433 TSecr=896594639
 52 1.534934074 192.168.222.7 -> 192.168.222.6 TLSv1.2 260 Client Key Exchange, Change Cipher Spec, Encrypted Handshake Message
 53 1.536836412 192.168.222.6 -> 192.168.222.7 TLSv1.2 340 New Session Ticket, Change Cipher Spec, Encrypted Handshake Message
 54 1.537209858 192.168.222.7 -> 192.168.222.6 TLSv1.2 350 Application Data
 55 1.543600273 192.168.222.6 -> 192.168.222.7 TLSv1.2 1251 Application Data, Application Data
 56 1.543733100 192.168.222.6 -> 192.168.222.7 TCP 66 https > 56747 [FIN, ACK] Seq=2946 Ack=738 Win=32256 Len=0 TSval=896594658 TSecr=896613442
 57 1.544381904 192.168.222.7 -> 192.168.222.6 TCP 66 56747 > https [FIN, ACK] Seq=738 Ack=2947 Win=38016 Len=0 TSval=896613449 TSecr=896594653
 58 1.544627696 192.168.222.6 -> 192.168.222.7 TCP 66 https > 56747 [ACK] Seq=2947 Ack=739 Win=32256 Len=0 TSval=896594659 TSecr=896613449
 59 1.596043185 192.168.222.7 -> 192.168.222.6 TCP 74 48913 > https [SYN] Seq=0 Win=29200 Len=0 MSS=1460 SACK_PERM=1 TSval=896613500 TSecr=0 WS=128
 60 1.596348776 192.168.222.6 -> 192.168.222.7 TCP 74 https > 48913 [SYN, ACK] Seq=0 Ack=1 Win=28960 Len=0 MSS=1460 SACK_PERM=1 TSval=896594711 TSecr=896613500 WS=128
 61 1.596361295 192.168.222.7 -> 192.168.222.6 TCP 66 48913 > https [ACK] Seq=1 Ack=1 Win=29312 Len=0 TSval=896613501 TSecr=896594711
 62 1.612361034 192.168.222.7 -> 192.168.222.6 SSL 325 Client Hello
 63 1.612640921 192.168.222.6 -> 192.168.222.7 TCP 66 https > 48913 [ACK] Seq=1 Ack=260 Win=30080 Len=0 TSval=896594727 TSecr=896613516
 64 1.619045100 192.168.222.6 -> 192.168.222.7 TLSv1.2 1552 Alert (Level: Warning, Description: Unrecognized Name), Server Hello, Certificate, Server Key Exchange, Server Hello Done
 65 1.619243969 192.168.222.7 -> 192.168.222.6 TCP 66 48913 > https [ACK] Seq=260 Ack=1487 Win=32256 Len=0 TSval=896613524 TSecr=896594729
 66 1.626186777 192.168.222.7 -> 192.168.222.6 TLSv1.2 260 Client Key Exchange, Change Cipher Spec, Encrypted Handshake Message
 67 1.628235328 192.168.222.6 -> 192.168.222.7 TLSv1.2 340 New Session Ticket, Change Cipher Spec, Encrypted Handshake Message
 68 1.628534492 192.168.222.7 -> 192.168.222.6 TLSv1.2 299 Application Data
 69 1.630091265 192.168.222.6 -> 192.168.222.7 TLSv1.2 329 Application Data, Application Data
 70 1.630165169 192.168.222.6 -> 192.168.222.7 TCP 66 https > 48913 [FIN, ACK] Seq=2024 Ack=687 Win=32256 Len=0 TSval=896594744 TSecr=896613533
 71 1.630670046 192.168.222.7 -> 192.168.222.6 TCP 66 48913 > https [FIN, ACK] Seq=687 Ack=2025 Win=38016 Len=0 TSval=896613535 TSecr=896594744
 72 1.630917523 192.168.222.6 -> 192.168.222.7 TCP 66 https > 48913 [ACK] Seq=2025 Ack=688 Win=32256 Len=0 TSval=896594745 TSecr=896613535
 73 1.662335663 192.168.222.7 -> 192.168.222.6 TCP 74 54304 > https [SYN] Seq=0 Win=29200 Len=0 MSS=1460 SACK_PERM=1 TSval=896613566 TSecr=0 WS=128
 74 1.662633165 192.168.222.6 -> 192.168.222.7 TCP 74 https > 54304 [SYN, ACK] Seq=0 Ack=1 Win=28960 Len=0 MSS=1460 SACK_PERM=1 TSval=896594777 TSecr=896613566 WS=128
 75 1.662658050 192.168.222.7 -> 192.168.222.6 TCP 66 54304 > https [ACK] Seq=1 Ack=1 Win=29312 Len=0 TSval=896613567 TSecr=896594777
 76 1.663189659 192.168.222.7 -> 192.168.222.6 SSL 325 Client Hello
 77 1.663431492 192.168.222.6 -> 192.168.222.7 TCP 66 https > 54304 [ACK] Seq=1 Ack=260 Win=30080 Len=0 TSval=896594778 TSecr=896613568
 78 1.669925658 192.168.222.6 -> 192.168.222.7 TLSv1.2 1552 Alert (Level: Warning, Description: Unrecognized Name), Server Hello, Certificate, Server Key Exchange, Server Hello Done
 79 1.669988277 192.168.222.7 -> 192.168.222.6 TCP 66 54304 > https [ACK] Seq=260 Ack=1487 Win=32256 Len=0 TSval=896613575 TSecr=896594778
 80 1.676215185 192.168.222.7 -> 192.168.222.6 TLSv1.2 260 Client Key Exchange, Change Cipher Spec, Encrypted Handshake Message
 81 1.677953904 192.168.222.6 -> 192.168.222.7 TLSv1.2 340 New Session Ticket, Change Cipher Spec, Encrypted Handshake Message
 82 1.678230612 192.168.222.7 -> 192.168.222.6 TLSv1.2 421 Application Data
 83 1.688766582 192.168.222.6 -> 192.168.222.7 TLSv1.2 407 Application Data, Application Data
 84 1.688936464 192.168.222.6 -> 192.168.222.7 TCP 66 https > 54304 [FIN, ACK] Seq=2102 Ack=809 Win=32256 Len=0 TSval=896594803 TSecr=896613583
 85 1.689531327 192.168.222.7 -> 192.168.222.6 TCP 66 54304 > https [FIN, ACK] Seq=809 Ack=2103 Win=38016 Len=0 TSval=896613594 TSecr=896594803
 86 1.689754966 192.168.222.6 -> 192.168.222.7 TCP 66 https > 54304 [ACK] Seq=2103 Ack=810 Win=32256 Len=0 TSval=896594804 TSecr=896613594
 87 2.009679920 192.168.222.7 -> 192.168.222.6 TCP 74 53037 > https [SYN] Seq=0 Win=29200 Len=0 MSS=1460 SACK_PERM=1 TSval=896613914 TSecr=0 WS=128
 88 2.009962678 192.168.222.6 -> 192.168.222.7 TCP 74 https > 53037 [SYN, ACK] Seq=0 Ack=1 Win=28960 Len=0 MSS=1460 SACK_PERM=1 TSval=896595124 TSecr=896613914 WS=128
 89 2.009998531 192.168.222.7 -> 192.168.222.6 TCP 66 53037 > https [ACK] Seq=1 Ack=1 Win=29312 Len=0 TSval=896613915 TSecr=896595124
 90 2.010423939 192.168.222.7 -> 192.168.222.6 SSL 325 Client Hello
 91 2.010618445 192.168.222.6 -> 192.168.222.7 TCP 66 https > 53037 [ACK] Seq=1 Ack=260 Win=30080 Len=0 TSval=896595125 TSecr=896613915
 92 2.017471165 192.168.222.6 -> 192.168.222.7 TLSv1.2 1552 Alert (Level: Warning, Description: Unrecognized Name), Server Hello, Certificate, Server Key Exchange, Server Hello Done
 93 2.017533286 192.168.222.7 -> 192.168.222.6 TCP 66 53037 > https [ACK] Seq=260 Ack=1487 Win=32256 Len=0 TSval=896613922 TSecr=896595128
 94 2.024041717 192.168.222.7 -> 192.168.222.6 TLSv1.2 260 Client Key Exchange, Change Cipher Spec, Encrypted Handshake Message
 95 2.025954984 192.168.222.6 -> 192.168.222.7 TLSv1.2 340 New Session Ticket, Change Cipher Spec, Encrypted Handshake Message
 96 2.026262914 192.168.222.7 -> 192.168.222.6 TLSv1.2 443 Application Data
 97 2.066240168 192.168.222.6 -> 192.168.222.7 TCP 66 https > 53037 [ACK] Seq=1761 Ack=831 Win=32256 Len=0 TSval=896595181 TSecr=896613931
 98 2.317159997 192.168.222.6 -> 192.168.222.7 TLSv1.2 338 Application Data, Application Data
 99 2.317284565 192.168.222.6 -> 192.168.222.7 TCP 66 https > 53037 [FIN, ACK] Seq=2033 Ack=831 Win=32256 Len=0 TSval=896595432 TSecr=896613931
100 2.317986397 192.168.222.7 -> 192.168.222.6 TCP 66 53037 > https [FIN, ACK] Seq=831 Ack=2034 Win=38016 Len=0 TSval=896614222 TSecr=896595431
101 2.318228326 192.168.222.6 -> 192.168.222.7 TCP 66 https > 53037 [ACK] Seq=2034 Ack=832 Win=32256 Len=0 TSval=896595433 TSecr=896614222
102 2.344644034 192.168.222.7 -> 192.168.222.6 TCP 74 54248 > https [SYN] Seq=0 Win=29200 Len=0 MSS=1460 SACK_PERM=1 TSval=896614249 TSecr=0 WS=128
103 2.344947288 192.168.222.6 -> 192.168.222.7 TCP 74 https > 54248 [SYN, ACK] Seq=0 Ack=1 Win=28960 Len=0 MSS=1460 SACK_PERM=1 TSval=896595459 TSecr=896614249 WS=128
104 2.344980282 192.168.222.7 -> 192.168.222.6 TCP 66 54248 > https [ACK] Seq=1 Ack=1 Win=29312 Len=0 TSval=896614250 TSecr=896595459
105 2.345477228 192.168.222.7 -> 192.168.222.6 SSL 325 Client Hello
106 2.345703931 192.168.222.6 -> 192.168.222.7 TCP 66 https > 54248 [ACK] Seq=1 Ack=260 Win=30080 Len=0 TSval=896595460 TSecr=896614250
107 2.352158989 192.168.222.6 -> 192.168.222.7 TLSv1.2 1552 Alert (Level: Warning, Description: Unrecognized Name), Server Hello, Certificate, Server Key Exchange, Server Hello Done
108 2.352223749 192.168.222.7 -> 192.168.222.6 TCP 66 54248 > https [ACK] Seq=260 Ack=1487 Win=32256 Len=0 TSval=896614257 TSecr=896595466
109 2.358567807 192.168.222.7 -> 192.168.222.6 TLSv1.2 260 Client Key Exchange, Change Cipher Spec, Encrypted Handshake Message
110 2.360420423 192.168.222.6 -> 192.168.222.7 TLSv1.2 340 New Session Ticket, Change Cipher Spec, Encrypted Handshake Message
111 2.360643476 192.168.222.7 -> 192.168.222.6 TLSv1.2 380 Application Data
112 2.369700637 192.168.222.6 -> 192.168.222.7 TLSv1.2 1062 Application Data, Application Data
113 2.369839413 192.168.222.6 -> 192.168.222.7 TCP 66 https > 54248 [FIN, ACK] Seq=2757 Ack=768 Win=32256 Len=0 TSval=896595484 TSecr=896614265
114 2.370547581 192.168.222.7 -> 192.168.222.6 TCP 66 54248 > https [FIN, ACK] Seq=768 Ack=2758 Win=38016 Len=0 TSval=896614275 TSecr=896595480
115 2.370746023 192.168.222.6 -> 192.168.222.7 TCP 66 https > 54248 [ACK] Seq=2758 Ack=769 Win=32256 Len=0 TSval=896595485 TSecr=896614275
116 2.408123575 192.168.222.7 -> 192.168.222.6 TCP 74 57827 > https [SYN] Seq=0 Win=29200 Len=0 MSS=1460 SACK_PERM=1 TSval=896614312 TSecr=0 WS=128
117 2.408419886 192.168.222.6 -> 192.168.222.7 TCP 74 https > 57827 [SYN, ACK] Seq=0 Ack=1 Win=28960 Len=0 MSS=1460 SACK_PERM=1 TSval=896595523 TSecr=896614312 WS=128
118 2.408445368 192.168.222.7 -> 192.168.222.6 TCP 66 57827 > https [ACK] Seq=1 Ack=1 Win=29312 Len=0 TSval=896614313 TSecr=896595523
119 2.409972260 192.168.222.7 -> 192.168.222.6 SSL 325 Client Hello
120 2.410175023 192.168.222.6 -> 192.168.222.7 TCP 66 https > 57827 [ACK] Seq=1 Ack=260 Win=30080 Len=0 TSval=896595524 TSecr=896614315
121 2.416767792 192.168.222.6 -> 192.168.222.7 TLSv1.2 1552 Alert (Level: Warning, Description: Unrecognized Name), Server Hello, Certificate, Server Key Exchange, Server Hello Done
122 2.416845338 192.168.222.7 -> 192.168.222.6 TCP 66 57827 > https [ACK] Seq=260 Ack=1487 Win=32256 Len=0 TSval=896614321 TSecr=896595530
123 2.423454640 192.168.222.7 -> 192.168.222.6 TLSv1.2 260 Client Key Exchange, Change Cipher Spec, Encrypted Handshake Message
124 2.425298913 192.168.222.6 -> 192.168.222.7 TLSv1.2 340 New Session Ticket, Change Cipher Spec, Encrypted Handshake Message
125 2.425594152 192.168.222.7 -> 192.168.222.6 TLSv1.2 448 Application Data
126 2.441924972 192.168.222.6 -> 192.168.222.7 TLSv1.2 338 Application Data, Application Data
127 2.441943738 192.168.222.6 -> 192.168.222.7 TCP 66 https > 57827 [FIN, ACK] Seq=2033 Ack=836 Win=32256 Len=0 TSval=896595556 TSecr=896614330
128 2.442632597 192.168.222.7 -> 192.168.222.6 TCP 66 57827 > https [FIN, ACK] Seq=836 Ack=2034 Win=38016 Len=0 TSval=896614347 TSecr=896595556
129 2.442866245 192.168.222.6 -> 192.168.222.7 TCP 66 https > 57827 [ACK] Seq=2034 Ack=837 Win=32256 Len=0 TSval=896595557 TSecr=896614347

----- TEST RUN

130 10.942727540     10.0.0.7 -> 10.0.0.6     TCP 74 58837 > scp-config [SYN] Seq=0 Win=29200 Len=0 MSS=1460 SACK_PERM=1 TSval=896622847 TSecr=0 WS=128
131 10.942981712     10.0.0.6 -> 10.0.0.7     TCP 60 scp-config > 58837 [RST, ACK] Seq=1 Ack=1 Win=0 Len=0
132 11.445752905     10.0.0.7 -> 10.0.0.6     TCP 74 46181 > scp-config [SYN] Seq=0 Win=29200 Len=0 MSS=1460 SACK_PERM=1 TSval=896623350 TSecr=0 WS=128
133 11.446196368     10.0.0.6 -> 10.0.0.7     TCP 74 scp-config > 46181 [SYN, ACK] Seq=0 Ack=1 Win=28960 Len=0 MSS=1460 SACK_PERM=1 TSval=896604560 TSecr=896623350 WS=128
134 11.446236760     10.0.0.7 -> 10.0.0.6     TCP 66 46181 > scp-config [ACK] Seq=1 Ack=1 Win=29312 Len=0 TSval=896623351 TSecr=896604560
135 11.446971647     10.0.0.7 -> 10.0.0.6     TCP 105 46181 > scp-config [PSH, ACK] Seq=1 Ack=1 Win=29312 Len=39 TSval=896623352 TSecr=896604560
136 11.447218640     10.0.0.6 -> 10.0.0.7     TCP 66 scp-config > 46181 [ACK] Seq=1 Ack=40 Win=29056 Len=0 TSval=896604561 TSecr=896623352
137 11.454688959     10.0.0.7 -> 10.0.0.6     TCP 66 46181 > scp-config [FIN, ACK] Seq=40 Ack=1 Win=29312 Len=0 TSval=896623358 TSecr=896604561
138 11.455096498     10.0.0.6 -> 10.0.0.7     TCP 66 scp-config > 46181 [FIN, ACK] Seq=1 Ack=41 Win=29056 Len=0 TSval=896604569 TSecr=896623358
139 11.455118335     10.0.0.7 -> 10.0.0.6     TCP 66 46181 > scp-config [ACK] Seq=41 Ack=2 Win=29312 Len=0 TSval=896623360 TSecr=896604569

----- RESULT COLLECTION

140 15.792211061 192.168.222.7 -> 192.168.222.6 TCP 74 59539 > https [SYN] Seq=0 Win=29200 Len=0 MSS=1460 SACK_PERM=1 TSval=896627697 TSecr=0 WS=128
141 15.792513179 192.168.222.6 -> 192.168.222.7 TCP 74 https > 59539 [SYN, ACK] Seq=0 Ack=1 Win=28960 Len=0 MSS=1460 SACK_PERM=1 TSval=896608906 TSecr=896627697 WS=128
142 15.792538014 192.168.222.7 -> 192.168.222.6 TCP 66 59539 > https [ACK] Seq=1 Ack=1 Win=29312 Len=0 TSval=896627697 TSecr=896608906
143 15.793893745 192.168.222.7 -> 192.168.222.6 SSL 325 Client Hello
144 15.794084088 192.168.222.6 -> 192.168.222.7 TCP 66 https > 59539 [ACK] Seq=1 Ack=260 Win=30080 Len=0 TSval=896608908 TSecr=896627698
145 15.800600734 192.168.222.6 -> 192.168.222.7 TLSv1.2 1552 Alert (Level: Warning, Description: Unrecognized Name), Server Hello, Certificate, Server Key Exchange, Server Hello Done
146 15.800701177 192.168.222.7 -> 192.168.222.6 TCP 66 59539 > https [ACK] Seq=260 Ack=1487 Win=32256 Len=0 TSval=896627705 TSecr=896608911
147 15.807116599 192.168.222.7 -> 192.168.222.6 TLSv1.2 260 Client Key Exchange, Change Cipher Spec, Encrypted Handshake Message
148 15.808910539 192.168.222.6 -> 192.168.222.7 TLSv1.2 340 New Session Ticket, Change Cipher Spec, Encrypted Handshake Message
149 15.809228891 192.168.222.7 -> 192.168.222.6 TLSv1.2 396 Application Data
150 15.819098205 192.168.222.6 -> 192.168.222.7 TLSv1.2 1264 Application Data, Application Data
151 15.819206157 192.168.222.6 -> 192.168.222.7 TCP 66 https > 59539 [FIN, ACK] Seq=2959 Ack=784 Win=32256 Len=0 TSval=896608933 TSecr=896627714
152 15.820042596 192.168.222.7 -> 192.168.222.6 TCP 66 59539 > https [FIN, ACK] Seq=784 Ack=2960 Win=38016 Len=0 TSval=896627725 TSecr=896608932
153 15.820238550 192.168.222.6 -> 192.168.222.7 TCP 66 https > 59539 [ACK] Seq=2960 Ack=785 Win=32256 Len=0 TSval=896608934 TSecr=896627725
154 16.153525337 192.168.222.7 -> 192.168.222.6 TCP 74 42455 > https [SYN] Seq=0 Win=29200 Len=0 MSS=1460 SACK_PERM=1 TSval=896628058 TSecr=0 WS=128
155 16.153767213 192.168.222.6 -> 192.168.222.7 TCP 74 https > 42455 [SYN, ACK] Seq=0 Ack=1 Win=28960 Len=0 MSS=1460 SACK_PERM=1 TSval=896609267 TSecr=896628058 WS=128
156 16.153792142 192.168.222.7 -> 

```
